{
  "event_id": "ebee7b5c-237d-86dc-a75e-f0a79b676815",
  "source": "node-http",
  "site_id": "site-quarry-north",
  "device_id": "nyquist",
  "device_class": "esp32s3-i2s-gps",
  "firmware_version": "hear-node-2026.09.1",
  "observed_at": "2026-09-14T18:03:11.250000Z",
  "received_at": "2026-09-14T18:03:11.984000Z",
  "clock": {
    "valid": true,
    "tier": "gps_pps",
    "sigma_ns": 420000
  },
  "kind": "detection",
  "schema_version": 1,
  "payload": {
    "wire_version": 2,
    "profile_id": 0,
    "frame_b64": "AAECAwQFBgcICQoLDA0ODw==",
    "peak_db": -12.5
  },
  "raw_ref": "raw/2026/09/14/nyquist/018f2c1a.bin",
  "adapter": {
    "name": "node-http",
    "version": "1.0.0"
  },
  "producer": {
    "boot_id": "018f2b90-5f3c-7c21-9a7e-1d2c3b4a5e6f",
    "boot_epoch_us": 1789495200000000,
    "sequence": 4471,
    "cursor": "dets:4471"
  }
}
